{
  "$schema": "./eval-dataset.schema.json",
  "dataset_version": "0.2.0",
  "status": "Stage 3 seed. Representative cases only; Stage 7 extends to about 40 legitimate and at least 10 attack cases per scenario 1-4, appending new IDs after the last one used here. IDs are never renumbered or reused. 0.2.0 (Stage 6, TP23): added Milestone 2 cases EVAL-093 to EVAL-105; EVAL-054 and EVAL-068 activated by TP5 and TP7.",
  "plan": "evaluation-plan.md (project root, authoritative)",
  "conventions": {
    "evidence_matching": "Scorer lowercases both the evidence sentence and each expected substring and strips all whitespace before a substring test, so '182 m' matches '182m' and '182 M'.",
    "evidence_format": "Distances in whole metres, speeds in whole km/h, loss percentages to one decimal with a % sign, yield as a multiple of the reference upper bound to two decimals followed by 'x' (see evaluation-plan.md §7.4).",
    "yield_units": "Yield is expressed as a ratio of U, the upper bound (max kg/ha) of the fixture crop reference row, after the cherry-to-clean conversion. No real Coffee Board figures appear in this file.",
    "gps_distance": "gps_place.distance_m is measured from the nearest polygon edge; 'inside_*' places are inside the polygon, 'outside_*' outside it.",
    "independence": "Every case is evaluated with its own context; no state carries between cases, so results do not depend on execution order."
  },
  "fixtures": {
    "yield_reference": {
      "unit": "U",
      "note": "U is a placeholder symbol. Stage 6 seeds crop_yield_reference from Coffee Board of India figures once verified (risk R6); until then the harness uses a synthetic U and every case is written as a multiple of it, so the cases stay valid when the real figure replaces it."
    },
    "plots": [
      { "id": "P01", "role": "legitimate", "area_ha": 2.0, "shape": "convex", "remote_sensing": { "deforestation_loss_pct_inside": 0, "ndvi_history": "perennial_canopy", "ndvi_harvest_window": "living_canopy" } },
      { "id": "P02", "role": "legitimate", "area_ha": 0.6, "shape": "irregular", "remote_sensing": { "deforestation_loss_pct_inside": 0, "ndvi_history": "perennial_canopy", "ndvi_harvest_window": "living_canopy" } },
      { "id": "P03", "role": "legitimate", "area_ha": 5.5, "shape": "irregular", "remote_sensing": { "deforestation_loss_pct_inside": 0, "ndvi_history": "perennial_canopy", "ndvi_harvest_window": "living_canopy" }, "notes": "Above 4 ha: exported as a polygon." },
      { "id": "P04", "role": "legitimate", "area_ha": 1.2, "shape": "concave_L", "remote_sensing": { "deforestation_loss_pct_inside": 0, "ndvi_history": "perennial_canopy", "ndvi_harvest_window": "living_canopy" }, "notes": "L-shaped; the notch is outside the polygon but inside its bounding box." },
      { "id": "P05", "role": "legitimate", "area_ha": 3.0, "shape": "convex", "remote_sensing": { "deforestation_loss_pct_inside": 0, "loss_adjacent_outside": true, "ndvi_history": "perennial_canopy", "ndvi_harvest_window": "living_canopy" }, "notes": "Post-2020 loss exists just outside the boundary only." },
      { "id": "P06", "role": "legitimate", "area_ha": 1.0, "shape": "convex", "remote_sensing": { "deforestation_loss_pct_inside": 0, "ndvi_history": "perennial_canopy", "ndvi_harvest_window": "living_canopy" } },
      { "id": "P07", "role": "legitimate", "area_ha": 0.4, "shape": "irregular", "remote_sensing": { "deforestation_loss_pct_inside": 0, "ndvi_history": "perennial_canopy", "ndvi_harvest_window": "living_canopy" }, "notes": "Very small plot; geofence buffer matters most here." },
      { "id": "P08", "role": "legitimate", "area_ha": 2.5, "shape": "convex", "remote_sensing": { "deforestation_loss_pct_inside": 0, "ndvi_history": "perennial_canopy", "ndvi_harvest_window": "living_canopy" } },
      { "id": "P09", "role": "legitimate", "area_ha": 1.8, "shape": "convex", "remote_sensing": { "deforestation_loss_pct_inside": 0, "ndvi_history": "perennial_canopy", "ndvi_harvest_window": "cloud_blocked" }, "notes": "Monsoon-month harvest window is cloud-covered." },
      { "id": "P10", "role": "legitimate", "area_ha": 4.0, "shape": "convex", "remote_sensing": { "deforestation_loss_pct_inside": 0, "ndvi_history": "perennial_canopy", "ndvi_harvest_window": "living_canopy" }, "notes": "Exactly 4.0 ha: boundary for polygon-versus-point export." },
      { "id": "E01", "role": "legitimate_edge", "area_ha": 1.5, "shape": "convex", "remote_sensing": { "deforestation_loss_pct_inside": 3.0, "ndvi_history": "perennial_canopy", "ndvi_harvest_window": "living_canopy" }, "notes": "Honest shade-coffee estate; the loss is shade-tree pruning. Same signal as X04." },
      { "id": "X01", "role": "adversarial", "area_ha": 2.0, "shape": "convex", "remote_sensing": { "deforestation_loss_pct_inside": 25.0, "ndvi_history": "cleared_then_planted", "ndvi_harvest_window": "living_canopy" } },
      { "id": "X02", "role": "adversarial", "area_ha": 1.0, "shape": "convex", "remote_sensing": { "deforestation_loss_pct_inside": 10.5, "ndvi_history": "perennial_canopy", "ndvi_harvest_window": "living_canopy" }, "notes": "Just above the 10 % hard-fail threshold (S5)." },
      { "id": "X03", "role": "adversarial", "area_ha": 1.0, "shape": "convex", "remote_sensing": { "deforestation_loss_pct_inside": 9.5, "ndvi_history": "perennial_canopy", "ndvi_harvest_window": "living_canopy" }, "notes": "Just below the 10 % hard-fail threshold." },
      { "id": "X04", "role": "adversarial", "area_ha": 1.5, "shape": "convex", "remote_sensing": { "deforestation_loss_pct_inside": 3.0, "ndvi_history": "perennial_canopy", "ndvi_harvest_window": "living_canopy" }, "notes": "Small clearing; data identical to E01." },
      { "id": "X05", "role": "adversarial", "area_ha": 1.2, "shape": "convex", "remote_sensing": { "deforestation_loss_pct_inside": 0, "ndvi_history": "annual_crop", "ndvi_harvest_window": "living_canopy" }, "notes": "GFW shows no loss, but the NDVI history is not perennial canopy." },
      { "id": "X06", "role": "adversarial", "area_ha": 2.0, "shape": "convex", "remote_sensing": { "deforestation_loss_pct_inside": 40.0, "ndvi_history": "cleared_then_planted", "ndvi_harvest_window": "bare" } },
      { "id": "X07", "role": "adversarial", "area_ha": 1.5, "shape": "convex", "remote_sensing": { "deforestation_loss_pct_inside": 0, "ndvi_history": "perennial_canopy", "ndvi_harvest_window": "bare" }, "notes": "Registered clean; the canopy was removed after registration." }
    ],
    "devices": [
      { "id": "D-A1", "agent": "agent-A", "state": "enrolled" },
      { "id": "D-A2", "agent": "agent-A", "state": "revoked" },
      { "id": "D-A3", "agent": "agent-A", "state": "enrolled", "notes": "Re-enrolment after the browser storage holding D-A2's key was cleared." },
      { "id": "D-B1", "agent": "agent-B", "state": "enrolled" },
      { "id": "K-X", "agent": null, "state": "never_enrolled", "notes": "A valid P-256 key the server has never seen." }
    ]
  },
  "cases": [
    {
      "id": "EVAL-001",
      "title": "Clean capture at plot centre, first event on the device",
      "feature": "verifier", "category": "functional", "suite": "harness-verifier",
      "case_class": "legitimate", "scenario": null, "gates": ["S2"], "critical_conditions": ["CF-02"],
      "priority": "critical", "automated": true, "milestone": "M1", "status": "active",
      "input": {
        "plot": "P01", "device": "D-A1",
        "mutations": [
          { "op": "gps_place", "where": "inside_centroid" },
          { "op": "gps_accuracy", "accuracy_m": 8 },
          { "op": "exif_gps", "mode": "offset", "distance_m": 10 },
          { "op": "exif_time", "mode": "offset", "offset_min": -2 },
          { "op": "client_clock", "offset_from_server_min": 0 },
          { "op": "prev_event", "none": true },
          { "op": "photos", "count": 2 },
          { "op": "season_cumulative", "ratio_after_event": 0.30 }
        ]
      },
      "expected": {
        "verdict": "Verified",
        "check_status": { "signature_valid": "ok", "chain_continuity": "ok", "photo_uniqueness": "ok", "geofence": "ok", "gps_accuracy": "ok", "exif_gps_agreement": "ok", "exif_time_agreement": "ok", "movement_plausibility": "ok", "deforestation_overlap": "ok", "ndvi_cultivation": "ok", "ndvi_harvest_window": "ok", "yield_plausibility": "ok" },
        "behavior": "Every check ok; seq 1 with the genesis previous hash is continuous."
      },
      "failure_conditions": ["Any verdict other than Verified", "Any check not ok", "Genesis event flagged by chain_continuity"],
      "tags": ["happy-path", "base-case"]
    },
    {
      "id": "EVAL-002",
      "title": "Second capture on the same plot 45 minutes later",
      "feature": "verifier", "category": "functional", "suite": "harness-verifier",
      "case_class": "legitimate", "scenario": null, "gates": ["S2"], "critical_conditions": ["CF-02"],
      "priority": "critical", "automated": true, "milestone": "M1", "status": "active",
      "input": {
        "plot": "P01", "device": "D-A1", "base_case": "EVAL-001",
        "mutations": [
          { "op": "gps_place", "where": "inside_near_edge", "distance_m": 40 },
          { "op": "prev_event", "distance_km": 0.1, "minutes_before": 45 },
          { "op": "chain", "seq_delta": 1, "prev_hash": "correct" },
          { "op": "season_cumulative", "ratio_after_event": 0.60 }
        ]
      },
      "expected": { "verdict": "Verified", "check_status": { "chain_continuity": "ok", "movement_plausibility": "ok" } },
      "failure_conditions": ["Any verdict other than Verified"],
      "tags": ["happy-path", "base-case"]
    },
    {
      "id": "EVAL-003",
      "title": "Small plot, capture 6 m inside the boundary",
      "feature": "verifier", "category": "functional", "suite": "harness-verifier",
      "case_class": "legitimate", "scenario": null, "gates": ["S2"], "critical_conditions": ["CF-02"],